{
    "algorithm": "sha256",
    "component": "fpp-lof-audio-sync",
    "created_utc": "2026-09-23T02:00:00Z",
    "entries": {
        "7964cad1adcfebce08cb4ff0f68317f6": {
            "rendition_sha256": "d74704ce3a65cf87cb80969c63bf6f032780201563dfdbefa6dd571c76399e79",
            "rendition_size": 24576,
            "source_rel": "Masters/Midnight Overture (MASTER).wav",
            "source_sha256": "5541910bb8c2068397e0421b873405434c54e3c1e35f1c33a0bc1cfe7ca2365f",
            "source_size": 61440
        },
        "80ebfb410f608193f94af6227279e13d": {
            "rendition_sha256": "ad7b7e26518340bda5ea1ed2d0e475485c665f175b6a79b0b2182ac858ff4c66",
            "rendition_size": 20480,
            "source_rel": "Northern_Lights_Theme.mp3",
            "source_sha256": "ffa6c822007f987733aecbb9bef7ad771afd154243eadc131cdfafa15724bcd6",
            "source_size": 51200
        }
    },
    "generation": "20260923T020000Z-5e1f0a3c",
    "map_sha256": "2329031b77e8790993d85a6bf10f305383053c7e1277d124aa1103215f88eaf8",
    "profile_id": "lof-viewer-aac-lc-m4a-v1",
    "rid_key_id": "fixture-r1",
    "role": "private-source-map",
    "source_map_version": 1,
    "supply_generation": "20260923T015500Z-a41c9e07",
    "supply_manifest_sha256": "04dc6d7e1f6d61bff4bbb1c78f63d925f49965ef2bb61cdb18e2967d4db5ffd8",
    "viewer_manifest_sha256": "903dea47dc8f5b9717c02177787bf49768b1a89b470d2d46e31c6b3bf4692e33"
}
